標題,連結,內文,來源,時間
印度西南暴雨釀山崩、橋垮 至少123死、上百人仍受困,https://news.google.com/read/CBMiywJBVV95cUxNNWg3LS1ra3NrXzNyQ3gwbzZ2emdJNHowZXJkWlVmRXRRTDQ1UlI2dUI2eDg4RkhYWWZMczFTY3dDaVN1cnFpczBQZXJlVkFmTENZRE1GRFBhaE5aQU41SjlMdV9wQ0lmSWUxNXBPVy1uT205dWdUUHF1Y3RyTEltQ2RCR0c0SFRTZF9uLWpYLUpUdG5tWmQtMmhMZHFYRXNmN1ZRbnVKYk5ybE8xc1hZd180ZkFTOXJIRl9yOGl1dm5mQ2NraGE3WmhoaTFLVVJMOGdmcnV3S2hOcEZ4Q3JPdjdwTE84eDVQNkpmc1piTFNSTTBaRnpvZ1V0ZGdqUzFHNUpUQXJZbFZUU2FYNHo0T01DQjhNRlB4WlZfVzRGOXQ5SmxGZGRNOTctRDlLQmx1VHBLOWphNFZRZ1dVUDRxRlgtb3VGTkRkbGs0?hl=zh-TW&gl=TW&ceid=TW%3Azh-Hant,"印度西南部克勒拉邦（Kerala）瓦亞納德縣（Wayanad）7月30日凌晨因暴雨引發土石流，泥水與土石傾洩而下，茶園和村莊受創，已至少造成123人死亡，受害者多是茶園工人與眷屬。30日畫面顯示，黃色泥水沖垮橋梁，火車在超高水位的鐵道上行駛，多處房舍被淹，大雨仍持續降下。
當局部署超過200名軍人，並出動直升機救援，官員表示至少3000多人平安移轉至避難所，但強烈雨勢與重要橋梁倒塌，使得救援行動十分困難，估計至少還有百人受困，但外界難以到達，擔憂死傷人數可能還會上升。此次土石流是克勒拉邦2018以來最嚴重的一次，該年8月的洪災奪去逾400條生命。
本次災害過後仍有大雨預報，多地均處於戒備狀態，14個地區中有10區學校關閉；總理莫迪則表示聯邦將協助救災，罹難者家屬可獲賠償20萬盧比（約新台幣7.8萬元）、傷者獲賠5萬盧比（約新台幣1.9萬元）。瓦亞納德位處西高止山脈的丘陵地區，在每年6到10月的季風季節期間，非常容易發生土石流。",Yahoo奇摩新聞,7月30日
凱米重創亞洲 菲律賓暴雨成災 水深及頸 馬尼拉進入緊急狀態,https://news.google.com/read/CBMijwNBVV95cUxNN3B1R05DYW4wSUdmQy14bkQ0cGJHZVFYYlpBZnNzRjRJTk9yb2tkbDZRYS16bVBuSEhvWmN0MEhKVmFvWHJVdXV1V2VSU1JFSnpFLWFRams4ZzdfdWh4RjMtVDRwZkhaTEVrMG1OMm15NFFHanNDMWFVVHVyVFp0N0ZIVE5iT1ZucmhPZFN4SzFTY2d3ZDh5OWZJbXJ2VnM0SEp3SUpBeDZYX2pDUGVQZ0t3aWp3Q21qQmdkdGw5YUxvM2hteGZ2QlU5SjJrcFZIVVZoX09BejlKRjdjV1o3bllSSDhIZjQzeDgwaEZvUGdid19kU2M4NWlxS1NfQ2EteDJsdnNVRHAtWUxWdlA4dThzU0FaOGJHdi1zRF9HRDFLenM5UVVYU0xoWEdtaUdkWVpza3VTVFV1ZDM5QnNaTG9GQ2xvcFB1ZlA5QlhBMHN5ZHNfdGFYLXc3aWRuUlB3TkdvYnpGc1h6cWUtTmx6d2U3czJldkg5eWRJMkJMczdGYTJwUkk4anFjZjdrSG8?hl=zh-TW&gl=TW&ceid=TW%3Azh-Hant,"凱米颱風肆虐亞洲，為台灣、日本、菲律賓等地帶來強風豪雨，菲律賓首都馬尼拉及周圍城市暴雨成災，當局24日宣布進入緊急狀態，有些地方水淹深至頸部，已造成至少12死、逾60萬人流離失所。現場畫面可見，民眾試圖穿越水深及腰的街道，或在水中推著自行車前進，房舍幾乎滅頂、車輛受困洪水中，與此同時仍不斷降下大雨。
菲國逾百架航班宣告取消、金融市場也暫告關閉，總統小馬可仕下令協助偏遠地區救災，大馬尼拉地區16個城市已要求提撥緊急資金。每年平均有20個熱帶風暴襲擊菲律賓，帶來土石流與洪水等致命災情。另外，凱米也襲擊日本西南部島嶼，與那國島24日午後出現時速達180公里的陣風；在台灣，凱米也造成2死279傷，至24日晚間災情近3500件，凱米已於25日清晨出海，並減弱為中度颱風。",Yahoo奇摩新聞,7月24日
高雄水利及滯洪設施奏效 凱米強颱淹水面積僅莫拉克9.2%,https://news.google.com/read/CBMi7AJBVV95cUxNY3lZQzNtckpsOFRqa1R2cElNMkhMN1YzZTJSVUNGZ1JKdGtNVXNwNktNT0VBdVhRM3FsSlRld3ZfOGl4V2hXQWM2cHdMaTBkUVR5UDVxNkl1azEwWVo1VG0xMENLYVVFbk1UWmVVbUdSSkdjMU5zTTVTNE9xR0E1YkNpREtocDdDaVk0bjY1TDhjekVuZlFFVm9yYUFKVFZTc0ZUQUNtWHM1anpxVmxQaFEzRVhXMUtIMDJQUzdPVVZfZS1Kc3lMQ3JmTkNBbWJEUVhPTTNLeG5LVWdyZzc0VndiZDdwQVgxemxkYllQQVJCTW5zSnI5REVfR2FraE1HTjN6cTduTkJNcEtyRVJRdm13anFjYjBSZDFkY3dMaTRtRkN3aDBIeUlJZE5wUjZtS3Vhc0E0ZEJ5cTBwanVtaUNsZGUta05tSVIzSmdRWHlMLThSeEZWWmNmWTFNUHh4a1BnVWVKTGp0QUtL?hl=zh-TW&gl=TW&ceid=TW%3Azh-Hant,"凱米颱風帶來致災性豪雨，加上同時間遭遇天文大潮，在高雄燕巢、岡山、大社、楠梓、大樹等行政區降下超過一百mm的時雨量，全市一百一十九條區域排水皆達一級警戒水位，對此，成大名譽教授游保杉表示，所幸近年強化的水利及滯洪設施發揮效用，從數據來看，淹水面積及退水時間都較之前更少、更快。(見圖)
高市府今(卅)日說明，根據統計資料，凱米颱風平地最大累計雨量為七百七十八.五mm(大樹區)，相較莫拉克颱風當時為七百二十九.五mm(大樹區)，致災性降雨嚴峻程度超過莫拉克；然而莫拉克颱風時，高雄只有一座本和里滯洪池，滯洪量僅十一萬噸，當時高雄市區多處淹水深度超過一公尺，低窪地區甚至達一層樓高。
相較現今，高雄已經完成二十五座滯洪池四百九十八萬噸滯洪量，約可容納二千四百五十座標準泳池的水量，凱米颱風期間二十五座滯洪池近全滿，若無這些滯洪池滯留洪水，讓四百九十八萬噸洪水漫流至市區，肯定會造成高雄更大淹水災情；另統計，凱米颱風造成高雄淹水面積四百九十八公頃，相較莫拉克颱風的五千四百公頃僅9.2%，且都會區的淹水大多一小時左右退水，時間也明顯縮短。
成功大學前工學院院長游保杉名譽教授指出，台灣位於颱風侵襲的路徑，未來氣候變遷可能讓侵襲台灣颱風的降雨有增強趨勢，這是台灣必須面對而無法避免的降雨條件，我們更需認知到，未來的降雨強度與總量超過目前水利設施保護標準的機會可能更為頻繁；當超過設計標準所造成的淹水應該是合理而可以接受現象，不宜輕易說治水無效來打擊水利工程師的言論。游教授也提到，國際上很早就認知從工程角度而言，淹水是無可避免地，因而提倡「與洪水共存」的理念；淹水最直接影響的是社區與民眾，因此建議上從中央、地方政府，下自社區與居民，宜共同參與建立韌性的防災體系。
高市府表示，將評估檢討提高保護標準並賡續執行相關排水改善工程，也提醒工程手段無法完全避免災害發生，協助民眾取得水情資訊、鼓勵淹水地區加裝防水閘門、輔導成立自主防災社區等各項有助於提升防洪韌性之策略，也會是持續努力的目標。",Yahoo奇摩新聞,7月30日
日本山形縣秋田縣大雨3死 逾千棟民宅淹水,https://news.google.com/read/CBMiWkFVX3lxTFB5anNoM1o0WVR3ak12T3J6ZS1fdGVVNG01bVVDU0p0cFNoVldfRmdheE5JdEp2VmJ5aTA5dVdVVFFkOUlocjNINFdNSV9FSWktdWlIWVpYQjlYd9IBX0FVX3lxTE9Lay1qdWt3RVFYYjlCX1RpY1hpaFV2ODNrMmQ5aFB5YVduT0pwMFduUGdhYjduUzZVV3VVUkYxc2EzbEFRU1REblpibjZmSlhVV1Vjc2FHVkE3T2FYcFBN?hl=zh-TW&gl=TW&ceid=TW%3Azh-Hant,"日本山形縣、秋田縣上週降下破紀錄大雨，已知造成3人死亡、多地水患與土石流等災情，超過1000棟民宅淹水。山形新幹線山形站至新庄站區間停駛至8月中旬。
日本放送協會（NHK）報導，山形縣與秋田縣受到梅雨鋒面影響，上週降下破紀錄大雨，導致最上川等多條河流氾濫，進一步造成多地淹水、土石流等災情。
山形縣內各地方政府表示，截至昨天下午4時，17個市町村約1100棟民宅淹水，包含遊佐町約350棟，戶澤村與酒田市分別約300棟。
另外，秋田縣政府表示，北秋田市有2棟民宅遭土石流侵襲受損；由利本莊市、橫手市等地共164棟民宅遭遇程度不一的淹水，還有長照機構也出現淹水災情。
山形縣與秋田縣內的地方政府仍在確認受災全貌。
山形地方電視台櫻桃電視台（SAY）報導，JR東日本公司宣布，受到豪雨影響，山形新幹線往返山形站至新庄站區間的列車停駛到8月中旬。
地方鐵道路線部分，JR東日本山形分支表示，奧羽本線村山站至新庄站之間的列車停駛到8月中；奧羽本線新庄站至院內站、陸羽東線及陸羽西線等部分區間停駛，目前不清楚何時能搶通。
NHK詢問山形縣與秋田縣警方後得知，受到大雨影響，兩縣各有2人與1人，總共3人死亡，其中包含山形縣新庄市的1名員警。
本月25日有兩名員警駕駛巡邏車值勤時，在山形縣新庄市一座橋梁附近遭大水沖走失聯，其中1名警察不幸死亡；昨天在警車被沖走的地點附近，有人發現1名男性死者，警方正在確認身分。
秋田市1名86歲老翁26日被人發現陳屍於雄物川。警方初步研判他疑似掉入水位上漲的河川中罹難。
至於失蹤部分，山形縣酒田市1名86歲婦人欲與家人撤離，行走在河畔步道時下落不明；25日，秋田縣湯澤市一處道路工地發生土石流，1名年逾六旬工程人員被捲入，至今生死未卜。",經濟日報,7月29日
高雄水利及滯洪設施發揮功效 凱米強颱淹水面積僅莫拉克9.2%,https://news.google.com/read/CBMihANBVV95cUxQSUo1TTdvN1I0RXZWOTF4Rno1SWJiSHEtNzNPSGpydm9hOUUtbVJDZVZRTUVzSkREdzhOOXliWGczVzVmMy1PaThTcWIxVzVkRVRQNU5aWENIQjBtS01TQXNrVHMyaEpGaGdtbHJ5aFRoRWo1dzdUaDVmYlJFTzh1bmtMN05fYnQ0OUhjRURMbFEzcHhUNEFTRktWaE9wdkNSWThMcWFaMHI4TkIwZFd3QWRuWVZObHlQSnNOLTZBdVNuV0c2RVl2WkxoWDFnYzhQX0I5b0FEcGtmd0JBVndUajJWMDBURHRzWVpXcmliYlhiYkp1UlhwSVBwX2Q1ajhDZEZ0RmJ5Z2cweENuRnBNRUk0Tlg0UlRPZ0VicDZzTUVMdHpHNXB4dDRUbHRSdkhnZlZDT2t4RF9Ua0JPVzRPUmhzX0tleWRZSFd4TGRLMTJLeXlmRF9LZ2VrTWF3TVRhRkkyWUVrQWZzRFZGVDZNRENxdldBTGdyNWtESHpRZXAzTTNP?hl=zh-TW&gl=TW&ceid=TW%3Azh-Hant,"CNEWS匯流新聞網記者李承值／台北報導
凱米颱風帶來致災性豪雨，加上同時間遭遇天文大潮，在高雄燕巢、岡山、大社、楠梓、大樹等行政區降下超過100mm的時雨量，全市119條區域排水皆達一級警戒水位。對此，成功大學前工學院院長、名譽教授游保杉表示，所幸近年強化的水利及滯洪設施發揮效用，從數據來看，淹水面積及退水時間都較之前更少、更快。
根據統計資料，凱米颱風平地最大累計雨量為778.5mm（大樹區），相較莫拉克颱風當時為729.5mm（大樹區），致災性降雨嚴峻程度超過莫拉克；然而莫拉克颱風時，高雄只有1座本和里滯洪池，滯洪量僅11萬噸，當時高雄市區多處淹水深度超過1公尺，低窪地區甚至達一層樓高。
相較今日，高雄已經完成25座滯洪池、498萬噸滯洪量，約可容納2450座標準泳池的水量，凱米颱風期間25座滯洪池近全滿，倘無這些滯洪池滯留洪水，讓498萬噸洪水漫流至市區，肯定會造成高雄更大淹水災情；另統計，相較莫拉克颱風的5400公頃，凱米颱風造成高雄淹水面積498公頃，僅9.2%，且都會區的淹水大多1小時左右退水，時間也明顯縮短。
游保杉指出，台灣位於颱風侵襲的路徑，未來氣候變遷，可能讓侵襲台灣颱風的降雨有增強趨勢，這是台灣必須面對而無法避免的降雨條件。他說，更需認知到，未來的降雨強度與總量，超過目前水利設施保護標準的機會可能更為頻繁，當超過設計標準所造成的淹水應該是合理而可以接受現象，不宜輕易說治水無效來打擊水利工程師的言論。
游保杉也提到，國際上很早就認知從工程角度而言，淹水是無可避免地，因而提倡「與洪水共存」的理念。他說，淹水最直接影響的是社區與民眾，因此建議上從中央、地方政府，下自社區與居民，宜共同參與建立韌性的防災體系。
高雄市府表示，將評估檢討提高保護標準並賡續執行相關排水改善工程，也提醒工程手段無法完全避免災害發生，協助市民取得水情資訊、鼓勵淹水地區加裝防水閘門、輔導成立自主防災社區等各項有助於提升防洪韌性之策略，也會是持續努力的目標。
照片來源：CNEWS匯流新聞網
《更多CNEWS匯流新聞網報導》
普濟堂慶關聖帝君聖誕百年繞境 蘇俊賓大溪親扛神將上陣
盧秀燕颱風天赴美出席僑宴 顏若芳質疑「為何不延後」
【文章轉載請註明出處】",Yahoo奇摩新聞,7月29日
河南極端暴雨 南陽單日雨量超過600毫米,https://news.google.com/read/CBMiZkFVX3lxTE1kVXljN2dYRWxpbWxwcGlYdHBsdzU4czFya2J3Z25FN3M3NnZneVNITHcwaW5iZEh0bHU0aXZMREUzQTUyWm5aNE4wOWYteEZGZnZVc0xGVVcxX2h0Y0JfbkVGZTZzd9IBa0FVX3lxTE1kZEV5U2tuQUZrcWR5aHpOYUc5d0FmNUEtTTFyb2lYckpnRnNBY255V0FjVUVZWUk2d21CU3ZUV3VVU0MwQnZqOEVLZEQxQU1MTFo1NDFycURUM2pmSG9mREszVVhvYkFqdzJz?hl=zh-TW&gl=TW&ceid=TW%3Azh-Hant,"


中國河南省連日降下極端暴雨，南陽市出現單日683.5毫米的破紀錄降雨量，多地淹水嚴重。（圖取自微博）
〔中央社〕中國河南省連日降下極端暴雨，南陽市出現單日683.5毫米的破紀錄降雨量，多地淹水嚴重，民眾說從沒遇過這麼大的雨。由於暴雨天氣仍將持續兩天，多座水庫持續洩洪，災情恐將擴大。
綜合央視新聞、界面新聞等陸媒報導，昨天迄今，河南西南部、中東部降下極端特大暴雨，南陽盆地出現災情，不少房屋被淹。河南省氣象台今晚6時30分發布最高等級的暴雨紅色預警。
請繼續往下閱讀...

中國氣象局指出，16日淩晨開始，南陽盆地遭遇極端強降雨，南陽、周口、許昌等地出現特大暴雨，最大降雨量出現在南陽社旗縣大馮營，若按昨天3時至今天3時統計，大馮營降雨量達到683.5毫米；最大每小時降雨量高達148.3毫米，大幅打破紀錄。
根據中國中央氣象台，15日9時至16日8時，中國降雨量前10名，河南就占9席，其中，南陽社旗以418.6毫米居全國第一。其後，河南社旗氣象站數據未再更新，氣象局回應稱，當地觀測站被淹被雷擊，正在搶修中。
河南省防汛抗旱指揮部早上8時針對南陽啟動防汛一級應急回應。
氣象預報顯示，未來2天，河南南部和東部仍將有暴雨。截至上午9時，河南已有7座大型水庫、22座中型水庫出現超汛限水位（超過防汛期水位上限），相繼啟動洩洪。接下來，災情恐雪上加霜。
網路影片顯示，南陽多地淹水嚴重，許多路段積水深至腰部，社旗縣淹水最高達1.5公尺。一名店鋪老闆因為貨物全部泡水損失慘重，他表示「往年沒有見過這麼大的雨」。
河南6月間才熬過大旱，現在又降下破紀錄暴雨。
家住在社旗縣三里橋村的鄭女士今天說，目前正在遭遇大洪水，已經有大半個村子在水裡泡著。「村子四面原本都是田地，現在玉米以及蔬菜類的農作物都在水裡泡著，損失嚴重」。
中國河南省連日降下極端暴雨，南陽市出現單日683.5毫米的破紀錄降雨量，多地淹水嚴重。（圖取自微博）
不用抽 不用搶 現在用APP看新聞 保證天天中獎　 點我下載APP　 按我看活動辦法

自由時報版權所有不得轉載© 2024 The Liberty Times. All Rights Reserved.
",自由時報,7月16日
南韓暴雨不歇 仁川機場24架次國際航班取消、北韓未通知南韓逕自開閘門洩洪,https://news.google.com/read/CBMi2ANBVV95cUxOR2FZSWExYmNZUG8za2ItQy1WU1V3RndnVWoxYUNnSGpwd0ptLW1RcmIzMnY0Yno0aTcybmFUZkdCM3NIa2RGckx4RUZDU01uUVp2dlFaZVdibk9hUkMyanNMcG1QUkZZQ3FvR2h3RWhjTXRTMlRtZ0Yzb2pzbkVRYWRySEJoSG9hSWNfX2ZTY3E3T2hNYk02VDJNeFRCeEl4VUtCRTJZaTNDMmFELXkxY0E0SzNuSGdtMTRPVDkyYjd0eXRYRHE3SVNZWUN5T2xvN05WVHlWR3BibjAzVHFMWTBZN3ZWR1VmcWFaVVZFbVI5UlFIRWUwc0hraTdocC0ycGRZTy05dlU2Sktsb2p5Q0g2SFFFU28tODhuV3l3ZnFsX3BiaHlxYmdLYjQxNWtxYUUzenktb1pkSkEzOXlDbTdOdUtqS3I3QnFYQXh5dUNnZC1IdzJIeEtlUW1XU2xrSnZhZGRUMjNxdmxFRk5nby1zTkRZYVpkMUFnaXl1YjY4M2lHWjVqamtTeEJISExPRkRVUlVZYzBqUkhYTXBqMWp5dEVZeFNGajNEMlhoTDlLemFscHhjWjVsSXQyYms5cUZYbVhFNGVLZ2lrY2htN0J0WXpJY3p0?hl=zh-TW&gl=TW&ceid=TW%3Azh-Hant,"包括首都首爾在內的南韓中部及北部近日豪雨不歇，釀成洪災。南韓氣象廳預測，到了明天（07/19），最大降雨量累計已超過300毫米。暴雨導致仁川機場今天子夜至上午8點間的航班大亂，25架次自仁川起飛的國際航班取消，4架次航班起飛後被迫返航。
南韓氣象廳16日即已發出大雨警報，警告民眾將有3天強降雨。這波豪雨實際上已持續逾一週，不但造成首爾地鐵一度停駛，數條公路封閉，多地釀土石流，民宅泡在水中。
路透社報導，南韓政府今天已下令住在河岸附近的中部地區民眾立即疏散。
韓聯社報導，南方北太平洋高壓和北部大範圍乾燥氣流接觸，形成強勢降雨雲帶，加上中尺度低壓發達，導致韓國中部地區持續暴雨。氣象廳今天（07/18）指出，南韓中部迄今晚的每小時降雨量將介於30至60毫米，最大降雨量估計將超過每小時70毫米。
到明天凌晨，滯留鋒將隨著北太平洋高壓的收縮而南下，且西南部海域將再有中尺度低壓經過，南部地區恐出現每小時20至30毫米的降雨。
根據氣象廳預報，中部地區截至19日最大降雨量將達150毫米，其中首都圈、江原內陸及山區、忠清、湖南（全羅道）降雨量約30至100毫米，首都圈及全羅北道更可能達到150毫米以上。
南韓這波雨勢估計將持續至21日，22日後鋒面北上，除了首都圈和江原道仍有降雨，南部地區將轉為高溫天氣。
南韓洪災也意外引發與北韓的新一波齟齬。南韓統一部官員今天表示，上月28日已要求北韓方面在打開兩韓邊界臨津江的黃江水壩閘門前，要提前通知韓方，但平壤當局仍於9日在未通知的情況下逕自開閘洩洪，對此深感遺憾。
2009年9月，北韓在未事先通知南韓的情况下打開黄江水壩閘門洩洪，造成在京畿道漣川郡一带露營的6名南韓民眾死亡，21輛汽車被淹。
南韓國防部則警告，北韓可能利用這波暴雨，埋入更多地雷，讓它們順著洪水與泥流進入南韓。
儘管每年7月是南韓雨季，但今年這波雨勢過於猛烈，南韓總統尹錫悅說，應將視為氣候變遷造成的影響。
更多太報報導
范斯正式接受川普副手提名 演講鎖定搖擺州「職業政客害慘我們」
華爾街日報向川普解釋：台灣不只晶片重要 還攸關太平洋區域穩定",Yahoo奇摩新聞,7月18日
賴比瑞亞洪水為患 國會議員提議遷都,https://news.google.com/read/CBMiWkFVX3lxTE1ieFVETzVwdGUxekp6SnFRNXhHOEdIMkR2SEliY09rQ0dmM0dnZkxtX3NxUjZ4Y1h6MFRjSEI2Z0Y5QWtET1hJZF9uTFJuU2Jpc3R4OU1SSVgtUdIBX0FVX3lxTE85dE9LRERHYXl3T0Rqc2lRS2JCOHRJR0N5QlhkTVlrdGJTSG1MMXZqNFRBeU9vSzRuMU5BeU5UUzhzWkI2bXBJRXcxc3YzVE1IUm53UFUxUnNqR3MtTzVJ?hl=zh-TW&gl=TW&ceid=TW%3Azh-Hant,"西非國家賴比瑞亞爆發數起洪災後，一群參議員提議將首都遷離人口過多、管理不善的蒙羅維亞（Monrovia）。有人對此熱情以對，也有人猶豫不決。
法新社報導，國家災害管理機構表示，6月底至7月初的豪雨引發爆洪，導致近5萬人急需援助。
容易淹水的蒙羅維亞災情尤其慘重，人口過多、貧乏的污水處理系統和缺少建築法規是部分原因。
參議院一個聯席委員會7月初開會討論存在已久的洪水問題，提議建立新城市取代蒙羅維亞。
蒙羅維亞是賴比瑞亞的經濟、政治、文化中心，蒙羅維亞自由港（Freeport of Monrovia）更是該國出口鐵礦、橡膠、木材至歐洲和美國的門戶。但該市基礎設施功能不彰，無法趕上不斷擴張的人口。
公共工程部告訴法新社，正就這項提案進行仔細探討，這項計畫沒有提出確切地點，任何決定總歸來說得從經濟可行性去考量。",經濟日報,7月22日
北韓洪水為患 蒲亭表達慰問並願提供人道援助,https://news.google.com/read/CBMid0FVX3lxTE1pZTJOZVR5bWJmMUs4TDk1SXZaRHY4S1FjVk9OUlRMbkRmM0l2RjRkdGpEMjhadG9oaGVkVlk4UW5UVDZoei1wQkFfRTBYdERoSkNIbGdFTUIySWgwaHl2Z3FyWFMtUkdLOUt5XzRyMkFTTFAyVUFZ0gFfQVVfeXFMTzYzZGo0M3NUVks5d0dfZW4zVDdaQ0Rac1U3eUNLYWhwZmJXNXVYR01LYUxiSlUyODl2QXdkMmx5bDh5TmNhMDl0QTVieTEzNE1KYlZtTW9samRma1lMWXc?hl=zh-TW&gl=TW&ceid=TW%3Azh-Hant,"克里姆林宮（Kremlin）昨天表示，北韓洪災造成數量不明的傷亡、數千間房屋受損，俄羅斯總統蒲亭已向北韓領導人金正恩表達慰問之意。
綜合法新社與路透社報導，北韓今天指出，蒲亭同時還表示願意對災後重建工作提供「立即的人道支持」。金正恩稱他「可以深深感受到對真正朋友的特殊情感」。
北韓本週表示，7月27日創紀錄的暴雨導致鄰近中國的北部地區發生洪災，房屋與大片農田淹水，死亡人數不詳。
根據北韓官媒中央通信社（KCNA）報導，最近幾天大雨襲擊西北部，導致4000多間房屋淹水，約5000名居民受困，金正恩親自視察災區並督導救援工作。
南韓負責兩韓交流事務的統一部1日表示，已準備好與北韓紅十字會討論救災事宜。這是南韓總統尹錫悅罕見對北韓伸出雙臂。
蒲亭在給金正恩的電報中說：「麻煩你向所有因暴風雨而失去親人的人，轉達慰問和支持。」
「您始終可以依靠我們的援助與支持。」
北韓中央通信社表示「莫斯科的慰問訊息昨天向北韓外交部轉達」，外交部立即呈報領袖金正恩。
金正恩感謝蒲亭伸出援手，同時表示「北韓備有應變措施，現階段已採取救災行動」。",經濟日報,8 天前
金正恩罕見為北韓洪災道歉 韓媒分析原因,https://news.google.com/read/CBMirAJBVV95cUxPeE9tS3NWMTRlQjhoQTB4SVR0bDRDT1lfYmdGQzNiSE5pMHU1YXRwQTJlZTJwOWUwUlUzX2JxSFZXNEhOV0ItNUcybk9WbW1HWVdkVTJwai1pM3VfUEVoUU44YTNfUUUteDJaVkFfN3Rtc21DMV9HRW9wdkU2eUx2VUd4U0FBRkx1QV9JT1pyYUhFbXlRNzlhMXZjMThLWTJTNThCelI2eXlSUWdrNWtXQzl6QU5OSkwwWno1RnJBcl9VdnRGeXljSS1nVDEtT3N5U0x6cTB2NmxKRnJXQmZNMkhOOW1YTzI2VDJ5dFhIU05xY3ZUYndRdGFwT0ZnVnhfSGhDZGV4T3ptU1hmMTd4S1JRWTdQNTRZeHp5V2pCZDFyeENTaWRVelJwQy0?hl=zh-TW&gl=TW&ceid=TW%3Azh-Hant,"[NOWnews今日新聞] 北韓與中國邊界相連的地區7月遭遇暴雨，導致鴨綠江氾濫，平安北道義州郡等地洪災嚴重，數千人一度受困，上萬人無家可歸，金正恩日前還曾搭乘小艇勘災，畫面掀起全球討論。近日再度接連造訪災區，更稱「自己沒能幫上什麼忙」，北韓官媒不斷釋出民眾哭慘的畫面，韓媒解讀金正恩近期參與救災動作不斷的背後目的。
根據韓聯社報導，金正恩連日部署鴨綠江洪災災區重建工作，試圖彰顯其災難管理領導力。
在8日至9日，金正恩接連前往平安北道義州郡視察，在災區演說中道歉稱，「自己沒能幫上什麼忙」，並宣布將災區1萬5400名學童送到平壤避難。
洪災，甚至一度造成5000人受困，北韓領導人金正恩更是親自走訪淹水災區視察。金正恩8日至9日再度前往平安北道義州郡視察，他在災區演說中道歉稱，「自己沒能幫上什麼忙。」隨後宣布要將災區1萬5400名學童送到平壤避難。
金正恩稱，兒童和學生的文化和教育問題，是即使天塌下來也絕不能妥協的國家首要問題，將透過緊急應對方針和便利的環境中提供教育，費用由國家承擔，直到洪水受損地區建造新房為止。
報導提到，金正恩明確表示，北韓並不會接受國際人道援助，隨後他多次聲稱韓國媒體捏造洪水災害報導，並將矛頭指向韓國，強調北韓會「嚴正地與敵人作戰」，還稱「敵人繼續愚蠢地利用我們受害的機會來玷污我們國家的形象。 」
從北韓官方釋出的畫面可看到，當金正恩造訪為災區民眾臨時搭建的帳篷時，孩童與成人都不斷做出誇張遮臉哭泣的表情。
韓聯社分析，金正恩不斷親臨洪水現場並發表演說，加上與幼兒親密接觸凸顯「親情」；同時，一句「我們應該以此為契機，糾正我們的敵對觀點」，藉由批評韓國媒體報導凝聚意識。
此外，金正恩透過動員30萬人並宣稱這些人自願參與救災，韓國政治分析學者認為，金正恩的目的是透過展現救援的領導力來防止失去威信，並向外界證明他有能力在不獲得其他國家支持的情況下獨自應對局勢。
更多 NOWnews 今日新聞 報導
金正恩勘災「搭救生艇」險撞樹！危險畫面釋出 專家也直呼罕見
不是接班人！金正恩兒子藏海外留學 推愛女露面當「煙霧彈」
北韓在等川普回來重啟核談判！叛逃外交官：金正恩不太懂國際外交",Yahoo奇摩新聞,昨天
